412,Primavera,CSS/img_flora/Alberi/albero3.jpg,CSS/img_flora/Arbusti/arbusto4.jpg,CSS/img_flora/PianteErbacee/PiantaErbacea5.jpg,Pianta erbacea,Rubiaceae,Psychotria domingensis Jacq.,Cheakyberry,2m,Monardella hypoleuca A. Gray ssp. lanata (Abrams) Munz,Khaki,14
413,Estate,CSS/img_flora/Alberi/albero7.jpg,CSS/img_flora/Arbusti/arbusto2.jpg,CSS/img_flora/PianteErbacee/PiantaErbacea10.jpg,Albero,Rosaceae,Prinsepia sinensis (Oliv.) Oliv. ex Bean,Cherry Prinsepia,1m,Cyperus houghtonii Torr.,Orange,11
414,Primavera,CSS/img_flora/Alberi/albero5.jpg,CSS/img_flora/Arbusti/arbusto7.jpg,CSS/img_flora/PianteErbacee/PiantaErbacea5.jpg,Albero,Asteraceae,Carphephorus paniculatus (J.F. Gmel.) Herb.,Hairy Chaffhead,3m,Smelowskia ovalis M.E. Jones,Red,30
415,Autunno,CSS/img_flora/Alberi/albero3.jpg,CSS/img_flora/Arbusti/arbusto3.jpg,CSS/img_flora/PianteErbacee/PiantaErbacea3.jpg,Arbusto,Cyperaceae,Cyperus bipartitus Torr.,Slender Flatsedge,3m,Pinus sabiniana Douglas ex Douglas,Green,37
416,Estate,CSS/img_flora/Alberi/albero7.jpg,CSS/img_flora/Arbusti/arbusto6.jpg,CSS/img_flora/PianteErbacee/PiantaErbacea6.jpg,Pianta erbacea,Caryophyllaceae,Cerastium beeringianum Cham. & Schltdl. ssp. beeringianum var. grandiflorum (Fenzl) Hultén,Bering Chickweed,4m,Desmodium humifusum (Muhl. ex Bigelow) Beck,Fuscia,27
417,Autunno,CSS/img_flora/Alberi/albero5.jpg,CSS/img_flora/Arbusti/arbusto4.jpg,CSS/img_flora/PianteErbacee/PiantaErbacea3.jpg,Albero,Brassicaceae,Streptanthus breweri A. Gray,Brewer's Jewelflower,1m,Psilotum ×intermedium W.H. Wagner,Teal,24
418,Autunno,CSS/img_flora/Alberi/albero3.jpg,CSS/img_flora/Arbusti/arbusto1.jpg,CSS/img_flora/PianteErbacee/PiantaErbacea3.jpg,Pianta erbacea,Ranunculaceae,Clematis hirsutissima Pursh var. arizonica (A. Heller) Erickson,Arizona Clematis,1m,Monolopia lanceolata Nutt.,Puce,2
419,Autunno,CSS/img_flora/Alberi/albero2.jpg,CSS/img_flora/Arbusti/arbusto7.jpg,CSS/img_flora/PianteErbacee/PiantaErbacea3.jpg,Pianta erbacea,Trypetheliaceae,Astrothelium confusum Müll. Arg.,Confused Astrothelium Lichen,3m,Ipomopsis Michx.,Blue,2
420,Estate,CSS/img_flora/Alberi/albero1.jpg,CSS/img_flora/Arbusti/arbusto3.jpg,CSS/img_flora/PianteErbacee/PiantaErbacea5.jpg,Albero,Juncaceae,Juncus arcticus Willd. ssp. alaskanus Hultén,Alaska Rush,4m,Heracleum sphondylium L. ssp. sibiricum (L.) Simonkai,Crimson,14
421,Estate,CSS/img_flora/Alberi/albero5.jpg,CSS/img_flora/Arbusti/arbusto7.jpg,CSS/img_flora/PianteErbacee/PiantaErbacea4.jpg,Albero,Fabaceae,Astragalus geyeri A. Gray var. geyeri,Geyer's Milkvetch,5m,Korthalsella cylindrica (v. Tiegh.) Engl.,Aquamarine,28
422,Primavera,CSS/img_flora/Alberi/albero5.jpg,CSS/img_flora/Arbusti/arbusto4.jpg,CSS/img_flora/PianteErbacee/PiantaErbacea5.jpg,Pianta erbacea,Gesneriaceae,Cyrtandra hawaiensis C.B. Clarke,Hawai'i Cyrtandra,2m,Quercus rubra L.,Green,6
423,Inverno,CSS/img_flora/Alberi/albero5.jpg,CSS/img_flora/Arbusti/arbusto6.jpg,CSS/img_flora/PianteErbacee/PiantaErbacea5.jpg,Pianta erbacea,Grossulariaceae,Ribes cereum Douglas,Wax Currant,5m,Oxytropis campestris (L.) DC. var. chartacea (Fassett) Barneby,Aquamarine,50
424,Estate,CSS/img_flora/Alberi/albero5.jpg,CSS/img_flora/Arbusti/arbusto7.jpg,CSS/img_flora/PianteErbacee/PiantaErbacea10.jpg,Albero,Asteraceae,Isocoma menziesii (Hook. & Arn.) G.L. Nesom,Menzies' Goldenbush,1m,"Rhus ×ashei (Small) Greene (pro sp.), database artifact",Red,34
425,Autunno,CSS/img_flora/Alberi/albero4.jpg,CSS/img_flora/Arbusti/arbusto7.jpg,CSS/img_flora/PianteErbacee/PiantaErbacea5.jpg,Albero,Betulaceae,Alnus oblongifolia Torr.,Arizona Alder,5m,Phlyctis willeyi Tuck.,Orange,18
426,Estate,CSS/img_flora/Alberi/albero3.jpg,CSS/img_flora/Arbusti/arbusto5.jpg,CSS/img_flora/PianteErbacee/PiantaErbacea4.jpg,Arbusto,Asteraceae,Lipochaeta kamolensis O. Deg. & Sherff,Maui Nehe,5m,Whipplea Torr.,Goldenrod,30
427,Autunno,CSS/img_flora/Alberi/albero5.jpg,CSS/img_flora/Arbusti/arbusto7.jpg,CSS/img_flora/PianteErbacee/PiantaErbacea6.jpg,Arbusto,Nyctaginaceae,Boerhavia triquetra S. Watson,Slender Spiderling,5m,Rhizomnium nudum (E. Britton & R.S. Williams) T. Kop.,Purple,28
428,Autunno,CSS/img_flora/Alberi/albero6.jpg,CSS/img_flora/Arbusti/arbusto2.jpg,CSS/img_flora/PianteErbacee/PiantaErbacea2.jpg,Pianta erbacea,Poaceae,Achnatherum coronatum (Thurb.) Barkworth,Giant Ricegrass,1m,Bouteloua curtipendula (Michx.) Torr.,Maroon,20
429,Primavera,CSS/img_flora/Alberi/albero3.jpg,CSS/img_flora/Arbusti/arbusto5.jpg,CSS/img_flora/PianteErbacee/PiantaErbacea1.jpg,Albero,Bignoniaceae,Distictis lactiflora (Vahl) DC.,Liana Fragante,4m,Ipomopsis aggregata (Pursh) V.E. Grant ssp. candida (Rydb.) V.E. Grant & A.D. Grant,Crimson,24
430,Primavera,CSS/img_flora/Alberi/albero3.jpg,CSS/img_flora/Arbusti/arbusto1.jpg,CSS/img_flora/PianteErbacee/PiantaErbacea8.jpg,Arbusto,Rubiaceae,Chione venosa (Sw.) Urb.,Fatpork,4m,Spiranthes ×simpsonii Catling & Sheviak,Turquoise,18
431,Estate,CSS/img_flora/Alberi/albero4.jpg,CSS/img_flora/Arbusti/arbusto6.jpg,CSS/img_flora/PianteErbacee/PiantaErbacea8.jpg,Arbusto,Agavaceae,Furcraea selloa K. Koch,Wild Sisal,2m,Carex aboriginum M.E. Jones,Orange,5
432,Primavera,CSS/img_flora/Alberi/albero6.jpg,CSS/img_flora/Arbusti/arbusto4.jpg,CSS/img_flora/PianteErbacee/PiantaErbacea1.jpg,Arbusto,Fabaceae,Baptisia calycosa Canby var. villosa Canby,Florida Wild Indigo,1m,Brachythecium campestre (Müll. Hal.) Schimp.,Green,16
433,Primavera,CSS/img_flora/Alberi/albero4.jpg,CSS/img_flora/Arbusti/arbusto6.jpg,CSS/img_flora/PianteErbacee/PiantaErbacea6.jpg,Pianta erbacea,Fabroniaceae,Fabronia Raddi,Fabronia Moss,3m,Bromus diandrus Roth,Purple,9
434,Primavera,CSS/img_flora/Alberi/albero1.jpg,CSS/img_flora/Arbusti/arbusto3.jpg,CSS/img_flora/PianteErbacee/PiantaErbacea2.jpg,Albero,Opegraphaceae,Opegrapha calcarea Turner ex Sm. & Sowerby,Calcareous Scribble Lichen,4m,Mentzelia leucophylla Brandegee,Violet,14
435,Estate,CSS/img_flora/Alberi/albero6.jpg,CSS/img_flora/Arbusti/arbusto6.jpg,CSS/img_flora/PianteErbacee/PiantaErbacea3.jpg,Arbusto,Hydrophyllaceae,Phacelia pallida I.M. Johnst.,Pale Phacelia,5m,Leucojum vernum L.,Khaki,39
436,Estate,CSS/img_flora/Alberi/albero5.jpg,CSS/img_flora/Arbusti/arbusto2.jpg,CSS/img_flora/PianteErbacee/PiantaErbacea2.jpg,Albero,Myrtaceae,Eucalyptus perriniana F. Muell. ex Rodway,Spinning Gum,3m,Carex planostachys Kunze,Yellow,43
437,Inverno,CSS/img_flora/Alberi/albero2.jpg,CSS/img_flora/Arbusti/arbusto1.jpg,CSS/img_flora/PianteErbacee/PiantaErbacea2.jpg,Pianta erbacea,Fabaceae,Lupinus sabinianus Douglas ex Lindl.,Sabin's Lupine,4m,Capsicum baccatum L. var. baccatum,Red,38
438,Estate,CSS/img_flora/Alberi/albero2.jpg,CSS/img_flora/Arbusti/arbusto4.jpg,CSS/img_flora/PianteErbacee/PiantaErbacea7.jpg,Pianta erbacea,Arecaceae,Ptychosperma macarthuri (H. Wendl. ex hort.) G. Nicholson,Macarthur Feather Palm,5m,Parochetus communis Buch.-Ham. ex D. Don,Purple,7
439,Autunno,CSS/img_flora/Alberi/albero1.jpg,CSS/img_flora/Arbusti/arbusto7.jpg,CSS/img_flora/PianteErbacee/PiantaErbacea8.jpg,Arbusto,Campanulaceae,Lobelia erinus L.,Edging Lobelia,2m,Salix barrattiana Hook.,Red,44
440,Autunno,CSS/img_flora/Alberi/albero3.jpg,CSS/img_flora/Arbusti/arbusto1.jpg,CSS/img_flora/PianteErbacee/PiantaErbacea2.jpg,Arbusto,Bryaceae,Bryum bornholmense Winkelm. & Ruthe,Bornholm's Bryum Moss,5m,Dalea cylindriceps Barneby,Purple,5
441,Estate,CSS/img_flora/Alberi/albero1.jpg,CSS/img_flora/Arbusti/arbusto2.jpg,CSS/img_flora/PianteErbacee/PiantaErbacea9.jpg,Albero,Poaceae,Puccinellia distans (Jacq.) Parl. ssp. hauptiana (Trin. ex Krecz.) W.E. Hughes,Hauptian Alkaligrass,2m,Hedyotis mannii Fosberg,Goldenrod,10
442,Estate,CSS/img_flora/Alberi/albero4.jpg,CSS/img_flora/Arbusti/arbusto7.jpg,CSS/img_flora/PianteErbacee/PiantaErbacea9.jpg,Arbusto,Parmeliaceae,Esslingeriana Hale & M.J. Lai,Esslingeriana Lichen,4m,Angelica arguta Nutt.,Maroon,31
443,Autunno,CSS/img_flora/Alberi/albero1.jpg,CSS/img_flora/Arbusti/arbusto1.jpg,CSS/img_flora/PianteErbacee/PiantaErbacea8.jpg,Pianta erbacea,Poaceae,Alopecurus arundinaceus Poir.,Creeping Meadow Foxtail,4m,Eupatorium rotundifolium L. var. ovatum (Bigelow) Torr.,Green,46
444,Inverno,CSS/img_flora/Alberi/albero1.jpg,CSS/img_flora/Arbusti/arbusto3.jpg,CSS/img_flora/PianteErbacee/PiantaErbacea8.jpg,Arbusto,Asteraceae,Brickellia pringlei A. Gray,Pringle's Brickellbush,2m,Retama raetam (Forssk.) Webb & Berthel.,Maroon,12
445,Autunno,CSS/img_flora/Alberi/albero5.jpg,CSS/img_flora/Arbusti/arbusto2.jpg,CSS/img_flora/PianteErbacee/PiantaErbacea6.jpg,Pianta erbacea,Asteraceae,Parasenecio auriculatus (DC.) J.R. Grant,Eared Indian Plantain,5m,Psychotria hawaiiensis (A. Gray) Fosberg var. scoriacea (Rock) Fosberg,Mauv,4
446,Autunno,CSS/img_flora/Alberi/albero2.jpg,CSS/img_flora/Arbusti/arbusto3.jpg,CSS/img_flora/PianteErbacee/PiantaErbacea4.jpg,Albero,Verbenaceae,Verbena scabra Vahl,Sandpaper Vervain,5m,Bigelowia nudata (Michx.) DC. ssp. nudata,Mauv,19
447,Inverno,CSS/img_flora/Alberi/albero1.jpg,CSS/img_flora/Arbusti/arbusto1.jpg,CSS/img_flora/PianteErbacee/PiantaErbacea4.jpg,Albero,Lamiaceae,Monarda bradburiana Beck,Eastern Beebalm,2m,Ceanothus serpyllifolius Nutt.,Goldenrod,47
448,Autunno,CSS/img_flora/Alberi/albero3.jpg,CSS/img_flora/Arbusti/arbusto3.jpg,CSS/img_flora/PianteErbacee/PiantaErbacea5.jpg,Arbusto,Elatinaceae,Elatine americana (Pursh) Arn.,American Waterwort,5m,Astragalus lentiginosus Douglas ex Hook.,Puce,47
449,Inverno,CSS/img_flora/Alberi/albero6.jpg,CSS/img_flora/Arbusti/arbusto5.jpg,CSS/img_flora/PianteErbacee/PiantaErbacea6.jpg,Albero,Fabaceae,Oxytropis lambertii Pursh,Purple Locoweed,3m,Sisyrinchium albidum Raf.,Orange,12
450,Inverno,CSS/img_flora/Alberi/albero3.jpg,CSS/img_flora/Arbusti/arbusto3.jpg,CSS/img_flora/PianteErbacee/PiantaErbacea7.jpg,Arbusto,Betulaceae,Alnus incana (L.) Moench ssp. rugosa (Du Roi) R.T. Clausen,Speckled Alder,4m,Passiflora anadenia Urb.,Aquamarine,26
451,Autunno,CSS/img_flora/Alberi/albero2.jpg,CSS/img_flora/Arbusti/arbusto1.jpg,CSS/img_flora/PianteErbacee/PiantaErbacea2.jpg,Arbusto,Araceae,Alocasia macrorrhizos (L.) G. Don,Giant Taro,5m,Arthonia punctiformis Ach.,Khaki,43
452,Primavera,CSS/img_flora/Alberi/albero5.jpg,CSS/img_flora/Arbusti/arbusto6.jpg,CSS/img_flora/PianteErbacee/PiantaErbacea5.jpg,Arbusto,Scrophulariaceae,Mimulus cusickii (Greene) Rattan,Cusick's Monkeyflower,2m,Ditrichum lineare (Sw.) Lindb.,Blue,3
453,Inverno,CSS/img_flora/Alberi/albero7.jpg,CSS/img_flora/Arbusti/arbusto3.jpg,CSS/img_flora/PianteErbacee/PiantaErbacea6.jpg,Albero,Nyctaginaceae,Mirabilis austrotexana B.L. Turner,Lonestar Four O'clock,2m,Delphinium multiplex (Ewan) C.L. Hitchc.,Blue,7
454,Estate,CSS/img_flora/Alberi/albero5.jpg,CSS/img_flora/Arbusti/arbusto6.jpg,CSS/img_flora/PianteErbacee/PiantaErbacea6.jpg,Arbusto,Asteraceae,Arnica parryi A. Gray ssp. sonnei (Greene) Maguire,Sonne's Arnica,2m,Harrimanella stelleriana (Pall.) Coville,Aquamarine,8
455,Autunno,CSS/img_flora/Alberi/albero3.jpg,CSS/img_flora/Arbusti/arbusto4.jpg,CSS/img_flora/PianteErbacee/PiantaErbacea9.jpg,Pianta erbacea,Cyperaceae,Carex ×sullivantii Boott,Sedge,1m,Calystegia macrostegia (Greene) Brummitt ssp. amplissima Brummitt,Teal,45
456,Autunno,CSS/img_flora/Alberi/albero2.jpg,CSS/img_flora/Arbusti/arbusto1.jpg,CSS/img_flora/PianteErbacee/PiantaErbacea9.jpg,Pianta erbacea,Acarosporaceae,Acarospora nodulosa (Dufour) Hue,Nodule Cracked Lichen,5m,Drosera linearis Goldie,Puce,40
457,Autunno,CSS/img_flora/Alberi/albero5.jpg,CSS/img_flora/Arbusti/arbusto6.jpg,CSS/img_flora/PianteErbacee/PiantaErbacea9.jpg,Pianta erbacea,Asteraceae,Liatris gholsonii L.C. Anderson,Gholson's Blazing Star,3m,Penstemon leonardii Rydb. var. patricus (N.H. Holmgren) Neese,Purple,38
458,Inverno,CSS/img_flora/Alberi/albero3.jpg,CSS/img_flora/Arbusti/arbusto4.jpg,CSS/img_flora/PianteErbacee/PiantaErbacea5.jpg,Albero,Pedaliaceae,Proboscidea parviflora (Wooton) Wooton & Standl. ssp. parviflora var. hohokamiana Bretting,Doubleclaw,4m,Pseudoleskea incurvata (Hedw.) Loeske var. incurvata,Mauv,45
459,Inverno,CSS/img_flora/Alberi/albero7.jpg,CSS/img_flora/Arbusti/arbusto7.jpg,CSS/img_flora/PianteErbacee/PiantaErbacea4.jpg,Arbusto,Grimmiaceae,Grimmia tenerrima Renauld & Cardot,Grimmia Dry Rock Moss,2m,Tectaria trifoliata (L.) Cav.,Crimson,49
460,Autunno,CSS/img_flora/Alberi/albero6.jpg,CSS/img_flora/Arbusti/arbusto4.jpg,CSS/img_flora/PianteErbacee/PiantaErbacea9.jpg,Albero,Asteraceae,Townsendia microcephala Dorn,Smallheaded Townsend Daisy,3m,Aristida havardii Vasey,Indigo,50
461,Estate,CSS/img_flora/Alberi/albero7.jpg,CSS/img_flora/Arbusti/arbusto4.jpg,CSS/img_flora/PianteErbacee/PiantaErbacea2.jpg,Arbusto,Boraginaceae,Mertensia platyphylla A. Heller,Broadleaf Bluebells,1m,Caulanthus cooperi (S. Watson) Payson,Pink,10
462,Autunno,CSS/img_flora/Alberi/albero4.jpg,CSS/img_flora/Arbusti/arbusto5.jpg,CSS/img_flora/PianteErbacee/PiantaErbacea6.jpg,Arbusto,Solanaceae,Physalis arenicola Kearney,Cypresshead Groundcherry,3m,Corymborkis Thouars,Khaki,26
463,Estate,CSS/img_flora/Alberi/albero2.jpg,CSS/img_flora/Arbusti/arbusto7.jpg,CSS/img_flora/PianteErbacee/PiantaErbacea7.jpg,Albero,Poaceae,Achnatherum parishii (Vasey) Barkworth var. parishii,Parish's Needlegrass,2m,Juncus effusus L. var. conglomeratus (L.) Engelm.,Pink,33
464,Autunno,CSS/img_flora/Alberi/albero2.jpg,CSS/img_flora/Arbusti/arbusto1.jpg,CSS/img_flora/PianteErbacee/PiantaErbacea9.jpg,Arbusto,Onagraceae,Camissonia hirtella (Greene) P.H. Raven,Santa Cruz Island Suncup,2m,Lecanactis abietina (Ach.) Körb.,Pink,11
465,Autunno,CSS/img_flora/Alberi/albero6.jpg,CSS/img_flora/Arbusti/arbusto2.jpg,CSS/img_flora/PianteErbacee/PiantaErbacea5.jpg,Pianta erbacea,Fagaceae,Quercus dumosa Nutt.,Coastal Sage Scrub Oak,3m,Paspalum rupestre Trin.,Aquamarine,27
466,Primavera,CSS/img_flora/Alberi/albero3.jpg,CSS/img_flora/Arbusti/arbusto3.jpg,CSS/img_flora/PianteErbacee/PiantaErbacea8.jpg,Pianta erbacea,Pottiaceae,Molendoa hornschuchiana (Hook.) Lindb. ex Limpr.,Hornschuch's Molendoa Moss,1m,Marshallia graminifolia (Walter) Small,Yellow,33
467,Inverno,CSS/img_flora/Alberi/albero5.jpg,CSS/img_flora/Arbusti/arbusto4.jpg,CSS/img_flora/PianteErbacee/PiantaErbacea4.jpg,Albero,Cercidiphyllaceae,Cercidiphyllum japonicum Siebold & Zucc.,Katsura Tree,3m,Fendlera rupicola A. Gray,Pink,48
468,Primavera,CSS/img_flora/Alberi/albero4.jpg,CSS/img_flora/Arbusti/arbusto4.jpg,CSS/img_flora/PianteErbacee/PiantaErbacea8.jpg,Albero,Myrtaceae,Eucalyptus megacarpa F. Muell.,Bullich,2m,Matelea alabamensis (Vail) Woodson,Fuscia,37
469,Primavera,CSS/img_flora/Alberi/albero3.jpg,CSS/img_flora/Arbusti/arbusto6.jpg,CSS/img_flora/PianteErbacee/PiantaErbacea10.jpg,Albero,Fabaceae,Lupinus saxosus Howell var. saxosus,Rock Lupine,1m,Spondias mombin L.,Green,49
470,Primavera,CSS/img_flora/Alberi/albero3.jpg,CSS/img_flora/Arbusti/arbusto2.jpg,CSS/img_flora/PianteErbacee/PiantaErbacea5.jpg,Arbusto,Rosaceae,Physocarpus capitatus (Pursh) Kuntze,Pacific Ninebark,1m,Lysimachia graminea (Greene) Hand.-Maz.,Puce,27
471,Estate,CSS/img_flora/Alberi/albero5.jpg,CSS/img_flora/Arbusti/arbusto1.jpg,CSS/img_flora/PianteErbacee/PiantaErbacea8.jpg,Albero,Violaceae,Viola helenae Forbes & Lydgate,Wahiawa Stream Violet,3m,Rinodina ascociscana Tuck.,Orange,45
472,Inverno,CSS/img_flora/Alberi/albero1.jpg,CSS/img_flora/Arbusti/arbusto4.jpg,CSS/img_flora/PianteErbacee/PiantaErbacea5.jpg,Albero,Isoetaceae,Isoetes acadiensis Kott,Acadian Quillwort,3m,Pseudognaphalium Kirp.,Blue,41
473,Estate,CSS/img_flora/Alberi/albero5.jpg,CSS/img_flora/Arbusti/arbusto5.jpg,CSS/img_flora/PianteErbacee/PiantaErbacea1.jpg,Albero,Asteraceae,Hesperevax sparsiflora (A. Gray) Greene var. brevifolia (A. Gray) Morefield,Shortleaf Dwarf-cudweed,5m,Cyrtosperma chamissonis (Schott) Merr.,Crimson,21
474,Estate,CSS/img_flora/Alberi/albero4.jpg,CSS/img_flora/Arbusti/arbusto5.jpg,CSS/img_flora/PianteErbacee/PiantaErbacea1.jpg,Pianta erbacea,Anacardiaceae,Toxicodendron vernicifluum (Stokes) F.A. Barkley,Chinese Lacquer,2m,Ipomoea coccinea L.,Green,9
475,Estate,CSS/img_flora/Alberi/albero3.jpg,CSS/img_flora/Arbusti/arbusto6.jpg,CSS/img_flora/PianteErbacee/PiantaErbacea7.jpg,Pianta erbacea,Fabaceae,Albizia odoratissima (L. f.) Benth.,Albizia,3m,Hemerocallis middendorffii Trautv. & C.A. Mey.,Crimson,21
476,Inverno,CSS/img_flora/Alberi/albero2.jpg,CSS/img_flora/Arbusti/arbusto3.jpg,CSS/img_flora/PianteErbacee/PiantaErbacea7.jpg,Pianta erbacea,Orchidaceae,Dichaea Lindl.,Leafystem Orchid,1m,Polyctenium fremontii (S. Watson) Greene var. fremontii,Violet,39
477,Autunno,CSS/img_flora/Alberi/albero6.jpg,CSS/img_flora/Arbusti/arbusto7.jpg,CSS/img_flora/PianteErbacee/PiantaErbacea1.jpg,Albero,Polemoniaceae,Phlox paniculata L.,Fall Phlox,4m,Duranta L.,Aquamarine,48
478,Autunno,CSS/img_flora/Alberi/albero6.jpg,CSS/img_flora/Arbusti/arbusto3.jpg,CSS/img_flora/PianteErbacee/PiantaErbacea2.jpg,Pianta erbacea,Poaceae,"Zea diploperennis Iltis, Doebley & Guzman [excluded]",Diploperennial Teosinte,2m,Bacopa monnieri (L.) Pennell,Orange,39
479,Autunno,CSS/img_flora/Alberi/albero7.jpg,CSS/img_flora/Arbusti/arbusto7.jpg,CSS/img_flora/PianteErbacee/PiantaErbacea9.jpg,Albero,Magnoliaceae,Magnolia acuminata (L.) L.,Cucumber Tree,3m,Castilleja miniata Douglas ex Hook.,Indigo,47
480,Autunno,CSS/img_flora/Alberi/albero5.jpg,CSS/img_flora/Arbusti/arbusto5.jpg,CSS/img_flora/PianteErbacee/PiantaErbacea9.jpg,Arbusto,Rubiaceae,Neolamarckia F. Bosser,Neolamarckia,3m,Ilex verticillata (L.) A. Gray,Orange,29
481,Estate,CSS/img_flora/Alberi/albero2.jpg,CSS/img_flora/Arbusti/arbusto1.jpg,CSS/img_flora/PianteErbacee/PiantaErbacea9.jpg,Pianta erbacea,Dryopteridaceae,Athyrium filix-femina (L.) Roth ssp. cyclosorum (Rupr.) C. Chr.,Subarctic Ladyfern,4m,"Gagea fistulosa (Ramond ex DC.) Ker Gawl., nom. illeg.",Fuscia,39
482,Autunno,CSS/img_flora/Alberi/albero3.jpg,CSS/img_flora/Arbusti/arbusto4.jpg,CSS/img_flora/PianteErbacee/PiantaErbacea8.jpg,Pianta erbacea,Bryoxiphiaceae,Bryoxiphium norvegicum (Brid.) Mitt.,Norway Bryoxiphium Moss,3m,Genista monspessulana (L.) L.A.S. Johnson,Purple,15
483,Autunno,CSS/img_flora/Alberi/albero2.jpg,CSS/img_flora/Arbusti/arbusto6.jpg,CSS/img_flora/PianteErbacee/PiantaErbacea3.jpg,Albero,Rosaceae,Prunus murrayana Palmer,Murray's Plum,2m,Woodwardia radicans (L.) J. Sm.,Violet,40
484,Autunno,CSS/img_flora/Alberi/albero4.jpg,CSS/img_flora/Arbusti/arbusto3.jpg,CSS/img_flora/PianteErbacee/PiantaErbacea1.jpg,Arbusto,Scrophulariaceae,Castilleja tenuiflora Benth.,Santa Catalina Indian Paintbrush,3m,Brickellia arguta B.L. Rob. var. arguta,Red,29
485,Inverno,CSS/img_flora/Alberi/albero5.jpg,CSS/img_flora/Arbusti/arbusto1.jpg,CSS/img_flora/PianteErbacee/PiantaErbacea1.jpg,Albero,Brassicaceae,Arabis puberula Nutt.,Silver Rockcress,3m,Lepidium montanum Nutt. var. jonesii (Rydb.) C.L. Hitchc.,Green,15
486,Inverno,CSS/img_flora/Alberi/albero3.jpg,CSS/img_flora/Arbusti/arbusto1.jpg,CSS/img_flora/PianteErbacee/PiantaErbacea6.jpg,Arbusto,Fabaceae,Pickeringia montana Nutt. ex Torr. & A. Gray var. tomentosa (Abrams) I.M. Johnst.,Chaparral Pea,3m,Astragalus allochrous A. Gray,Teal,46
487,Autunno,CSS/img_flora/Alberi/albero6.jpg,CSS/img_flora/Arbusti/arbusto6.jpg,CSS/img_flora/PianteErbacee/PiantaErbacea7.jpg,Albero,Scrophulariaceae,Stemodia schottii Holz.,Rio Grande Twintip,3m,Lupinus truncatus Nutt. ex Hook. & Arn.,Turquoise,37
488,Primavera,CSS/img_flora/Alberi/albero4.jpg,CSS/img_flora/Arbusti/arbusto3.jpg,CSS/img_flora/PianteErbacee/PiantaErbacea8.jpg,Albero,Vitaceae,Ampelopsis aconitifolia Bunge,Monkshoodvine,5m,Justicia warnockii B.L. Turner,Mauv,15
489,Primavera,CSS/img_flora/Alberi/albero4.jpg,CSS/img_flora/Arbusti/arbusto4.jpg,CSS/img_flora/PianteErbacee/PiantaErbacea1.jpg,Arbusto,Liliaceae,Androstephium breviflorum S. Watson,Pink Funnel Lily,1m,Schizanthus Ruiz & Pav.,Blue,5
490,Inverno,CSS/img_flora/Alberi/albero5.jpg,CSS/img_flora/Arbusti/arbusto3.jpg,CSS/img_flora/PianteErbacee/PiantaErbacea3.jpg,Pianta erbacea,Asteraceae,Erigeron lassenianus Greene,Mt. Lassen Fleabane,5m,Astragalus praelongus Sheldon var. ellisiae (Rydb.) Barneby,Purple,3
491,Estate,CSS/img_flora/Alberi/albero5.jpg,CSS/img_flora/Arbusti/arbusto4.jpg,CSS/img_flora/PianteErbacee/PiantaErbacea7.jpg,Pianta erbacea,Ericaceae,Arctostaphylos auriculata Eastw.,Mt. Diablo Manzanita,3m,Polygonum cuspidatum Siebold & Zucc.,Aquamarine,17
492,Autunno,CSS/img_flora/Alberi/albero5.jpg,CSS/img_flora/Arbusti/arbusto1.jpg,CSS/img_flora/PianteErbacee/PiantaErbacea2.jpg,Arbusto,Asteraceae,Hedypnois cretica (L.) Dum. Cours.,Cretanweed,5m,Machaeranthera grindelioides (Nutt.) Shinners var. depressa (Maguire) Cronquist & D.D. Keck,Purple,21
493,Autunno,CSS/img_flora/Alberi/albero5.jpg,CSS/img_flora/Arbusti/arbusto6.jpg,CSS/img_flora/PianteErbacee/PiantaErbacea9.jpg,Pianta erbacea,Fabaceae,Glycine max (L.) Merr.,Soybean,5m,Stenorrhynchos Rich. ex Spreng.,Teal,46
494,Estate,CSS/img_flora/Alberi/albero3.jpg,CSS/img_flora/Arbusti/arbusto6.jpg,CSS/img_flora/PianteErbacee/PiantaErbacea3.jpg,Pianta erbacea,Salicaceae,Populus tremuloides Michx.,Quaking Aspen,2m,Carex polymorpha Muhl.,Blue,37
495,Estate,CSS/img_flora/Alberi/albero6.jpg,CSS/img_flora/Arbusti/arbusto1.jpg,CSS/img_flora/PianteErbacee/PiantaErbacea4.jpg,Arbusto,Fabaceae,Acacia genistifolia Link,Early Wattle,2m,Eriogonum ericifolium Torr. & A. Gray,Turquoise,3
496,Inverno,CSS/img_flora/Alberi/albero1.jpg,CSS/img_flora/Arbusti/arbusto4.jpg,CSS/img_flora/PianteErbacee/PiantaErbacea9.jpg,Arbusto,Crassulaceae,Graptopetalum rusbyi (Greene) Rose,San Francisco River Leatherpetal,3m,Arceuthobium microcarpum (Engelm.) Hawksw. & Wiens,Pink,27
497,Estate,CSS/img_flora/Alberi/albero2.jpg,CSS/img_flora/Arbusti/arbusto2.jpg,CSS/img_flora/PianteErbacee/PiantaErbacea10.jpg,Arbusto,Scrophulariaceae,Penstemon thompsoniae (A. Gray) Rydb. ssp. jaegeri D.D. Keck,Jaeger's Beardtongue,2m,Stipa grandis P.A. Smirn.,Mauv,42
498,Inverno,CSS/img_flora/Alberi/albero7.jpg,CSS/img_flora/Arbusti/arbusto1.jpg,CSS/img_flora/PianteErbacee/PiantaErbacea7.jpg,Albero,Cyperaceae,Carex loliacea L.,Ryegrass Sedge,1m,Warnockia scutellarioides (Engelm. & A. Gray) M.W. Turner,Crimson,30
499,Estate,CSS/img_flora/Alberi/albero6.jpg,CSS/img_flora/Arbusti/arbusto4.jpg,CSS/img_flora/PianteErbacee/PiantaErbacea1.jpg,Pianta erbacea,Rubiaceae,Rondeletia L.,Cordobancillo,5m,Quercus ×moreha Kellogg (pro sp.),Aquamarine,20
500,Estate,CSS/img_flora/Alberi/albero2.jpg,CSS/img_flora/Arbusti/arbusto2.jpg,CSS/img_flora/PianteErbacee/PiantaErbacea8.jpg,Albero,Apocynaceae,Trachelospermum difforme (Walter) A. Gray,Climbing Dogbane,3m,Ludwigia simpsonii Chapm.,Maroon,17
501,Inverno,CSS/img_flora/Alberi/albero7.jpg,CSS/img_flora/Arbusti/arbusto4.jpg,CSS/img_flora/PianteErbacee/PiantaErbacea10.jpg,Pianta erbacea,Fissidentaceae,Fissidens fontanus (B. Pyl.) Steud.,Fissidens Moss,3m,Pleuropogon hooverianus (L.D. Benson) J.T. Howell,Turquoise,1
502,Primavera,CSS/img_flora/Alberi/albero5.jpg,CSS/img_flora/Arbusti/arbusto7.jpg,CSS/img_flora/PianteErbacee/PiantaErbacea10.jpg,Albero,Orchidaceae,Aplectrum hyemale (Muhl. ex Willd.) Torr.,Adam And Eve,4m,Heliotropium lagoense (Warm.) Guerke,Purple,48
503,Primavera,CSS/img_flora/Alberi/albero4.jpg,CSS/img_flora/Arbusti/arbusto2.jpg,CSS/img_flora/PianteErbacee/PiantaErbacea4.jpg,Arbusto,Brassicaceae,Physaria chambersii Rollins,Chambers' Twinpod,4m,Panicum amarum Elliott,Puce,39
504,Autunno,CSS/img_flora/Alberi/albero4.jpg,CSS/img_flora/Arbusti/arbusto2.jpg,CSS/img_flora/PianteErbacee/PiantaErbacea5.jpg,Pianta erbacea,Pinaceae,Picea ×lutzii Little,Hybrid Spruce,2m,Rubus meracus L.H. Bailey,Teal,10
505,Primavera,CSS/img_flora/Alberi/albero5.jpg,CSS/img_flora/Arbusti/arbusto4.jpg,CSS/img_flora/PianteErbacee/PiantaErbacea1.jpg,Arbusto,Teloschistaceae,Fulgensia fulgens (Sw.) Elenkin,Sulphur Lichen,3m,Muhlenbergia uniflora (Muhl.) Fernald,Turquoise,48
506,Inverno,CSS/img_flora/Alberi/albero7.jpg,CSS/img_flora/Arbusti/arbusto1.jpg,CSS/img_flora/PianteErbacee/PiantaErbacea10.jpg,Arbusto,Marantaceae,Thalia geniculata L.,Bent Alligator-flag,5m,Manfreda maculosa (Hook.) Rose,Yellow,27
507,Primavera,CSS/img_flora/Alberi/albero6.jpg,CSS/img_flora/Arbusti/arbusto4.jpg,CSS/img_flora/PianteErbacee/PiantaErbacea7.jpg,Albero,Sapindaceae,Litchi Sonn.,Lychee,5m,Mycobilimbia berengeriana (A. Massal.) Hafellner & V. Wirth,Fuscia,15
508,Estate,CSS/img_flora/Alberi/albero7.jpg,CSS/img_flora/Arbusti/arbusto5.jpg,CSS/img_flora/PianteErbacee/PiantaErbacea1.jpg,Albero,Asteraceae,Inula L.,Yellowhead,1m,Ludwigia longifolia (DC.) H. Hara,Purple,6
509,Autunno,CSS/img_flora/Alberi/albero1.jpg,CSS/img_flora/Arbusti/arbusto4.jpg,CSS/img_flora/PianteErbacee/PiantaErbacea10.jpg,Arbusto,Meliaceae,Trichilia roka (Forssk.) Chiov.,Trichilia,2m,Amsinckia lunaris J.F. Macbr.,Puce,11
510,Autunno,CSS/img_flora/Alberi/albero5.jpg,CSS/img_flora/Arbusti/arbusto5.jpg,CSS/img_flora/PianteErbacee/PiantaErbacea2.jpg,Pianta erbacea,Nelumbonaceae,Nelumbo Adans.,Lotus,2m,Viola ×esculenta Elliott (pro sp.),Violet,35
511,Primavera,CSS/img_flora/Alberi/albero2.jpg,CSS/img_flora/Arbusti/arbusto7.jpg,CSS/img_flora/PianteErbacee/PiantaErbacea7.jpg,Albero,Rosaceae,Potentilla glandulosa Lindl. ssp. micropetala (Rydb.) D.D. Keck,Smallpetal Cinquefoil,4m,Erythroxylum novogranatense (Morris) Hieron.,Maroon,38
512,Primavera,CSS/img_flora/Alberi/albero1.jpg,CSS/img_flora/Arbusti/arbusto3.jpg,CSS/img_flora/PianteErbacee/PiantaErbacea10.jpg,Pianta erbacea,Garryaceae,Garrya fadyenia Hook.,Fadyen's Silktassel,5m,Callirhoe involucrata (Torr. & A. Gray) A. Gray var. involucrata,Aquamarine,24
513,Inverno,CSS/img_flora/Alberi/albero4.jpg,CSS/img_flora/Arbusti/arbusto5.jpg,CSS/img_flora/PianteErbacee/PiantaErbacea2.jpg,Arbusto,Thelypteridaceae,Macrothelypteris (H. Itô) Ching,Macrothelypteris,1m,Vulpia octoflora (Walter) Rydb. var. octoflora,Aquamarine,26
514,Primavera,CSS/img_flora/Alberi/albero2.jpg,CSS/img_flora/Arbusti/arbusto5.jpg,CSS/img_flora/PianteErbacee/PiantaErbacea7.jpg,Arbusto,Poaceae,Dichanthelium dichotomum (L.) Gould var. breve (Hitchc. & Chase) Gould & C.A. Clark,Cypress Panicgrass,3m,Ceratopteris pteridoides (Hook.) Hieron.,Khaki,19
